STU0092,Computer Science,Third Year,Male,Yes,Neutral,Right After Graduation,Gaming,3,3,3.0,"Cybersecurity, Cloud / DevOps, Programming / Coding","Product Management, Leadership, Sales",Low,Family Pressure / Expectations,"Lack of a Good Idea, Lack of Funding",Medium,"Angel Investors, College Incubator",YCombinator,Maybe,No,5.2
STU0093,Computer Science,Fourth Year,Male,Yes,Very Interested,After 2-3 Years of Job,FinTech,4,2,3.0,"Cloud / DevOps, Data Analysis, Programming / Coding","Product Management, Marketing, Sales",Low,No Co-founder / Team,"Unclear Market Opportunity, Prefer Job Security",High,"College Incubator, Angel Investors","IIM Incubation Cell, YCombinator",Yes,No,6.7
STU0094,Information Technology,Second Year,Male,Yes,Somewhat Interested,Right After Graduation,AI/ML,4,3,3.5,"Cloud / DevOps, Web Development",Financial Planning,Medium,No Co-founder / Team,Lack of a Good Idea,Medium,"Crowdfunding, College Incubator",YCombinator,Yes,Yes,7.1
STU0095,Mechanical,Fourth Year,Male,No,Neutral,After 2-3 Years of Job,E-commerce,3,3,3.0,"Cybersecurity, Web Development","Product Management, Sales",Medium,Prefer Job Security,"Unclear Market Opportunity, Fear of Failure",Medium,Angel Investors,NASSCOM,Maybe,Yes,5.7
STU0096,Computer Science,Third Year,Female,Yes,Somewhat Interested,During College,FinTech,4,3,3.5,"Cloud / DevOps, Cybersecurity, Web Development","Sales, Marketing, Leadership",Low,Fear of Failure,Prefer Job Security,Medium,Government Grants,Startup India,No,Yes,6.7
STU0097,Computer Science,Second Year,Female,No,Very Interested,Right After Graduation,SaaS,3,3,3.0,"AI / Machine Learning, App Development, Web Development","Sales, Marketing, Financial Planning",High,Lack of Funding,"Unclear Market Opportunity, Prefer Job Security",Low,"Crowdfunding, Angel Investors","IIM Incubation Cell, YCombinator",Yes,Yes,6.7
STU0098,Computer Science,Fourth Year,Female,No,Very Interested,After 5+ Years,SaaS,4,3,3.5,"Cloud / DevOps, AI / Machine Learning","Leadership, Marketing, Financial Planning",Low,No Co-founder / Team,Unclear Market Opportunity,Low,"Government Grants, Bootstrapping",IIM Incubation Cell,No,Yes,6.2
STU0099,Electronics,Third Year,Female,No,Neutral,During College,HealthTech,3,3,3.0,"Data Analysis, Web Development, Cloud / DevOps","Product Management, Networking",Low,Lack of Business Knowledge,Fear of Failure,Low,"College Incubator, Bootstrapping","YCombinator, IIT TBI",Maybe,No,4.3
STU0100,Civil,Third Year,Female,Yes,Somewhat Interested,During College,Gaming,2,2,2.0,"Programming / Coding, Cloud / DevOps","Financial Planning, Leadership",Medium,Fear of Failure,"Lack of Business Knowledge, No Co-founder / Team",Low,College Incubator,"IIT TBI, Startup India",Maybe,No,4.8
STU0101,Information Technology,First Year,Female,Yes,Somewhat Interested,After 5+ Years,GreenTech,5,3,4.0,"Programming / Coding, Web Development","Financial Planning, Marketing",Low,Lack of a Good Idea,"Lack of Business Knowledge, Unclear Market Opportunity",Low,Bootstrapping,"IIM Incubation Cell, IIT TBI",Yes,Yes,6.7
STU0102,Electronics,Second Year,Male,No,Somewhat Interested,After 5+ Years,E-commerce,4,4,4.0,"Data Analysis, Programming / Coding, App Development",Communication,Low,Lack of a Good Idea,"Fear of Failure, Prefer Job Security",Medium,"Angel Investors, Crowdfunding",IIT TBI,Maybe,No,6.2
STU0103,MBA,First Year,Female,No,Very Interested,After 2-3 Years of Job,Social Impact,1,3,2.0,Data Analysis,"Sales, Financial Planning, Marketing",High,Fear of Failure,Family Pressure / Expectations,Low,Venture Capital,IIT TBI,Maybe,Yes,5.7
STU0104,BBA,Fourth Year,Female,Yes,Neutral,After 5+ Years,Social Impact,2,3,2.5,"Programming / Coding, Data Analysis","Marketing, Financial Planning",Low,Lack of Business Knowledge,No Co-founder / Team,High,Government Grants,"YCombinator, IIM Incubation Cell",Yes,No,5.2
STU0105,Information Technology,Third Year,Male,Yes,Somewhat Interested,After 2-3 Years of Job,GreenTech,5,3,4.0,"App Development, Programming / Coding, Web Development","Financial Planning, Communication, Marketing",Medium,Fear of Failure,"Prefer Job Security, Family Pressure / Expectations",High,Government Grants,"NASSCOM, IIM Incubation Cell",Maybe,Yes,8.1
STU0106,Computer Science,Fourth Year,Male,No,Somewhat Interested,After 2-3 Years of Job,FinTech,4,2,3.0,Web Development,"Leadership, Marketing, Product Management",Medium,Lack of Funding,"No Co-founder / Team, Unclear Market Opportunity",Medium,Angel Investors,"YCombinator, IIT TBI",Maybe,Yes,6.2
STU0107,Computer Science,First Year,Female,No,Somewhat Interested,Right After Graduation,SaaS,5,1,3.0,"App Development, Cloud / DevOps, AI / Machine Learning","Communication, Networking",Medium,Lack of Funding,"Lack of Business Knowledge, Unclear Market Opportunity",Low,"Bootstrapping, College Incubator","NASSCOM, YCombinator",No,No,5.2
STU0108,Mechanical,Fourth Year,Prefer not to say,Yes,Very Interested,After 5+ Years,HealthTech,2,3,2.5,"Data Analysis, Web Development","Networking, Leadership",High,Lack of a Good Idea,No Co-founder / Team,High,"Government Grants, Venture Capital","NASSCOM, IIM Incubation Cell",Yes,Yes,7.6
STU0109,Information Technology,Fourth Year,Male,No,Neutral,During College,GreenTech,3,3,3.0,"Web Development, Programming / Coding, Cloud / DevOps",Marketing,Low,Prefer Job Security,"Lack of a Good Idea, Fear of Failure",Medium,Crowdfunding,"IIM Incubation Cell, Startup India",No,No,4.8
STU0110,BBA,Fourth Year,Female,No,Somewhat Interested,During College,E-commerce,2,4,3.0,"App Development, AI / Machine Learning, Programming / Coding","Sales, Product Management",High,Lack of Funding,Lack of Business Knowledge,Medium,"Crowdfunding, Venture Capital","None, IIM Incubation Cell",Maybe,Yes,6.7
STU0111,Information Technology,Fourth Year,Male,Yes,Very Interested,Right After Graduation,Social Impact,3,3,3.0,"Data Analysis, Cybersecurity, Web Development",Networking,Medium,Lack of Funding,"Fear of Failure, Lack of Business Knowledge",High,"Bootstrapping, Venture Capital",Startup India,Maybe,Yes,7.6
STU0112,Civil,Fourth Year,Female,Yes,Very Interested,Right After Graduation,AgriTech,3,3,3.0,"Cybersecurity, App Development","Communication, Product Management, Networking",Low,Lack of Funding,Prefer Job Security,Low,"Bootstrapping, Angel Investors",YCombinator,No,No,5.7
STU0113,MBA,Second Year,Female,No,Somewhat Interested,After 2-3 Years of Job,EdTech,1,4,2.5,"AI / Machine Learning, Programming / Coding",Networking,Medium,No Co-founder / Team,"Unclear Market Opportunity, Lack of a Good Idea",Medium,"Bootstrapping, Angel Investors",YCombinator,Maybe,Yes,5.7
STU0114,Computer Science,Third Year,Male,No,Somewhat Interested,Never,Gaming,5,3,4.0,"App Development, Data Analysis, Web Development","Leadership, Sales",High,Lack of a Good Idea,Lack of Funding,Low,"College Incubator, Venture Capital",Startup India,No,No,6.7
STU0115,Civil,Fourth Year,Male,No,Somewhat Interested,Right After Graduation,AI/ML,3,2,2.5,Data Analysis,"Marketing, Product Management, Networking",Low,Lack of Funding,Fear of Failure,Low,"Crowdfunding, Government Grants","NASSCOM, None",Yes,Yes,4.8
STU0116,Electronics,Third Year,Male,No,Very Interested,Right After Graduation,Gaming,5,3,4.0,"Programming / Coding, AI / Machine Learning, Web Development",Sales,Medium,Fear of Failure,"Family Pressure / Expectations, Lack of a Good Idea",Medium,Angel Investors,"YCombinator, Startup India",Yes,Yes,7.6
STU0117,Information Technology,Second Year,Female,Yes,Somewhat Interested,Never,SaaS,4,3,3.5,Data Analysis,"Financial Planning, Networking",Medium,Fear of Failure,"Lack of Business Knowledge, Lack of Funding",Medium,Bootstrapping,"Startup India, None",Maybe,No,6.7
STU0118,Information Technology,Fourth Year,Male,Yes,Somewhat Interested,Right After Graduation,AI/ML,4,2,3.0,Data Analysis,"Communication, Product Management",Medium,Fear of Failure,"Unclear Market Opportunity, No Co-founder / Team",High,"Bootstrapping, Government Grants",YCombinator,No,No,6.7
STU0119,Computer Science,Third Year,Male,Yes,Very Interested,Right After Graduation,Gaming,3,2,2.5,Web Development,Networking,High,No Co-founder / Team,Family Pressure / Expectations,Medium,"College Incubator, Government Grants","YCombinator, NASSCOM",Yes,Yes,7.1
STU0120,Information Technology,Fourth Year,Male,Yes,Somewhat Interested,After 2-3 Years of Job,EdTech,4,3,3.5,AI / Machine Learning,Networking,Low,Lack of Funding,"Fear of Failure, No Co-founder / Team",Low,Government Grants,"None, Startup India",Maybe,Yes,6.2
STU0121,Computer Science,Fourth Year,Male,No,Neutral,After 2-3 Years of Job,Gaming,3,1,2.0,"App Development, Web Development","Marketing, Leadership, Sales",Medium,Family Pressure / Expectations,Fear of Failure,Low,Bootstrapping,"IIT TBI, Startup India",Maybe,No,3.8
STU0122,Mechanical,First Year,Male,No,Very Interested,During College,SaaS,2,4,3.0,"Data Analysis, AI / Machine Learning, Cloud / DevOps","Networking, Product Management, Financial Planning",High,No Co-founder / Team,Lack of Business Knowledge,Medium,Venture Capital,IIM Incubation Cell,Maybe,No,6.7
STU0123,Information Technology,Third Year,Female,Yes,Somewhat Interested,During College,FinTech,4,3,3.5,"Data Analysis, Cloud / DevOps, Programming / Coding",Networking,Low,Lack of a Good Idea,Fear of Failure,High,"College Incubator, Crowdfunding","NASSCOM, YCombinator",Yes,Yes,7.1
STU0124,Computer Science,First Year,Female,No,Not Interested,Never,EdTech,4,2,3.0,"Data Analysis, Web Development",Leadership,Medium,Lack of Business Knowledge,"Prefer Job Security, Unclear Market Opportunity",Medium,"Crowdfunding, Bootstrapping","None, Startup India",Yes,Yes,5.2
STU0125,Electronics,First Year,Male,No,Somewhat Interested,Right After Graduation,E-commerce,4,3,3.5,"Web Development, Cybersecurity",Marketing,Medium,Lack of Funding,"Lack of Business Knowledge, Fear of Failure",Medium,Crowdfunding,"Startup India, IIM Incubation Cell",No,No,6.2
STU0126,MBA,Fourth Year,Female,Yes,Neutral,After 2-3 Years of Job,EdTech,2,4,3.0,"Cybersecurity, Cloud / DevOps, Programming / Coding","Networking, Communication",Low,Prefer Job Security,"Family Pressure / Expectations, No Co-founder / Team",Medium,"Crowdfunding, Angel Investors",Startup India,No,Yes,5.7
STU0127,Mechanical,Second Year,Female,Yes,Not Interested,Never,HealthTech,3,2,2.5,Cybersecurity,"Product Management, Marketing",Low,Fear of Failure,No Co-founder / Team,Low,College Incubator,IIM Incubation Cell,No,No,3.8
STU0128,Mechanical,Fourth Year,Female,No,Very Interested,After 2-3 Years of Job,SaaS,3,2,2.5,"App Development, Data Analysis, AI / Machine Learning","Sales, Leadership",Medium,Fear of Failure,"No Co-founder / Team, Lack of Business Knowledge",Medium,College Incubator,"Startup India, YCombinator",Maybe,No,5.7
STU0129,Information Technology,Third Year,Female,No,Not Interested,Never,HealthTech,4,3,3.5,App Development,"Leadership, Sales, Product Management",Low,Family Pressure / Expectations,"Lack of Funding, Lack of a Good Idea",Low,Crowdfunding,Startup India,Maybe,Yes,4.8
STU0130,Information Technology,Fourth Year,Female,Yes,Somewhat Interested,After 2-3 Years of Job,AgriTech,3,3,3.0,"Cloud / DevOps, Cybersecurity","Leadership, Financial Planning, Communication",Low,Fear of Failure,Family Pressure / Expectations,High,"College Incubator, Venture Capital",Startup India,No,No,6.2
STU0131,Computer Science,Second Year,Female,Yes,Somewhat Interested,After 2-3 Years of Job,Gaming,4,3,3.5,"Cybersecurity, Cloud / DevOps, App Development",Product Management,Medium,Lack of Funding,Unclear Market Opportunity,Medium,Venture Capital,"YCombinator, Startup India",Maybe,No,6.7
STU0132,Computer Science,Fourth Year,Female,Yes,Very Interested,After 5+ Years,FinTech,3,2,2.5,"Cybersecurity, Web Development",Financial Planning,High,No Co-founder / Team,"Fear of Failure, Prefer Job Security",Low,Venture Capital,IIT TBI,Yes,Yes,6.7
STU0133,Electronics,Third Year,Male,No,Not Interested,Never,AI/ML,4,2,3.0,"Cybersecurity, Cloud / DevOps, App Development",Product Management,Low,Fear of Failure,Lack of Business Knowledge,Medium,"Angel Investors, College Incubator","YCombinator, IIT TBI",No,No,4.3
STU0134,Computer Science,Fourth Year,Male,Yes,Neutral,After 5+ Years,SaaS,4,2,3.0,"Cybersecurity, App Development, Data Analysis","Leadership, Marketing, Networking",Medium,Prefer Job Security,Unclear Market Opportunity,Medium,"Crowdfunding, Venture Capital","None, IIT TBI",Maybe,No,5.7
STU0135,Computer Science,First Year,Male,Yes,Somewhat Interested,Never,EdTech,4,2,3.0,AI / Machine Learning,"Networking, Financial Planning",Medium,Lack of Funding,"Lack of a Good Idea, Lack of Business Knowledge",High,"Government Grants, Venture Capital","None, YCombinator",No,No,6.7
STU0136,BBA,Third Year,Male,No,Very Interested,Right After Graduation,FinTech,3,5,4.0,"Data Analysis, Cybersecurity","Financial Planning, Sales, Marketing",High,No Co-founder / Team,"Lack of Business Knowledge, Prefer Job Security",High,College Incubator,"Startup India, YCombinator",Maybe,Yes,8.6
STU0137,Computer Science,Fourth Year,Male,No,Neutral,After 2-3 Years of Job,EdTech,4,2,3.0,Cybersecurity,Sales,Medium,Prefer Job Security,Lack of a Good Idea,Low,"Bootstrapping, Angel Investors","YCombinator, IIT TBI",No,No,4.8
STU0138,BBA,Second Year,Male,No,Somewhat Interested,During College,E-commerce,2,5,3.5,"Programming / Coding, Web Development","Sales, Financial Planning, Leadership",Low,Fear of Failure,"Family Pressure / Expectations, Lack of Funding",High,Bootstrapping,Startup India,No,Yes,6.7
STU0139,Information Technology,Third Year,Male,No,Not Interested,Never,Social Impact,2,2,2.0,"AI / Machine Learning, Data Analysis, Cloud / DevOps",Sales,Low,Prefer Job Security,"Lack of Funding, Lack of Business Knowledge",Medium,"Government Grants, Crowdfunding","None, IIT TBI",No,Yes,3.8
STU0140,BBA,Fourth Year,Male,Yes,Neutral,After 2-3 Years of Job,Social Impact,3,4,3.5,AI / Machine Learning,Networking,High,Fear of Failure,Lack of Funding,High,"Bootstrapping, Venture Capital",YCombinator,No,No,7.1
STU0141,Electronics,Fourth Year,Female,No,Very Interested,Right After Graduation,FinTech,3,2,2.5,Programming / Coding,Leadership,Medium,Fear of Failure,Family Pressure / Expectations,Medium,"Crowdfunding, College Incubator","IIM Incubation Cell, None",Yes,No,5.7
STU0142,Computer Science,Second Year,Male,No,Neutral,Right After Graduation,FinTech,5,2,3.5,"App Development, Data Analysis, Cloud / DevOps","Leadership, Marketing",Medium,Family Pressure / Expectations,Unclear Market Opportunity,Low,"Angel Investors, Bootstrapping","IIT TBI, YCombinator",Yes,No,5.2
STU0143,Information Technology,Fourth Year,Male,Yes,Somewhat Interested,During College,AI/ML,5,2,3.5,"App Development, Cybersecurity, Cloud / DevOps",Leadership,Low,No Co-founder / Team,"Lack of Funding, Lack of Business Knowledge",Medium,"Venture Capital, Bootstrapping","IIM Incubation Cell, NASSCOM",Maybe,Yes,6.7
STU0144,Mechanical,Third Year,Prefer not to say,No,Very Interested,After 5+ Years,GreenTech,3,2,2.5,"Data Analysis, Cloud / DevOps","Product Management, Marketing, Communication",High,No Co-founder / Team,"Prefer Job Security, Lack of Funding",High,"Crowdfunding, Venture Capital","IIT TBI, IIM Incubation Cell",Yes,No,6.7
STU0145,Computer Science,Fourth Year,Female,Yes,Neutral,Right After Graduation,FinTech,5,2,3.5,"Web Development, Cloud / DevOps, Cybersecurity","Financial Planning, Networking, Marketing",Medium,Family Pressure / Expectations,Prefer Job Security,Medium,Bootstrapping,"IIM Incubation Cell, Startup India",No,Yes,6.7
STU0146,Mechanical,Fourth Year,Male,Yes,Very Interested,Right After Graduation,E-commerce,4,3,3.5,"AI / Machine Learning, App Development","Networking, Communication",Medium,Fear of Failure,Lack of Funding,Low,Venture Capital,"Startup India, IIM Incubation Cell",Maybe,No,6.7
STU0147,Computer Science,First Year,Female,Yes,Very Interested,During College,FinTech,3,3,3.0,"AI / Machine Learning, Cybersecurity, Programming / Coding","Leadership, Networking",Medium,Lack of Funding,"Prefer Job Security, Fear of Failure",Low,Government Grants,"NASSCOM, Startup India",Maybe,No,6.2
STU0148,Information Technology,First Year,Female,No,Neutral,Never,AI/ML,4,2,3.0,"Cybersecurity, Programming / Coding","Leadership, Marketing, Networking",High,Fear of Failure,"Family Pressure / Expectations, Lack of Business Knowledge",Low,"Venture Capital, Bootstrapping",YCombinator,Maybe,No,5.2
STU0149,Computer Science,Third Year,Male,No,Somewhat Interested,After 2-3 Years of Job,EdTech,3,2,2.5,"AI / Machine Learning, Cybersecurity, Web Development","Product Management, Leadership, Financial Planning",Low,Lack of Funding,Family Pressure / Expectations,Low,College Incubator,"Startup India, NASSCOM",Maybe,No,4.3
STU0150,Mechanical,Fourth Year,Prefer not to say,No,Somewhat Interested,After 2-3 Years of Job,AgriTech,5,3,4.0,"Cloud / DevOps, Programming / Coding",Product Management,Medium,Lack of Funding,"Lack of Business Knowledge, No Co-founder / Team",Medium,Bootstrapping,"Startup India, YCombinator",Yes,Yes,7.1
STU0151,Computer Science,Third Year,Male,Yes,Very Interested,Right After Graduation,FinTech,4,4,4.0,"Cloud / DevOps, Web Development, Programming / Coding",Marketing,Medium,Lack of Funding,Prefer Job Security,High,"Venture Capital, Government Grants",None,Maybe,No,8.1
STU0152,MBA,Third Year,Male,No,Somewhat Interested,During College,Social Impact,3,4,3.5,Cloud / DevOps,"Sales, Networking",Low,Fear of Failure,Lack of Business Knowledge,Medium,Crowdfunding,"IIM Incubation Cell, YCombinator",Maybe,Yes,6.2
STU0153,Computer Science,Third Year,Male,Yes,Not Interested,Never,FinTech,4,3,3.5,"AI / Machine Learning, Data Analysis, Programming / Coding",Product Management,Low,Prefer Job Security,"Family Pressure / Expectations, Lack of a Good Idea",High,"Crowdfunding, Bootstrapping",NASSCOM,Maybe,No,5.7
STU0154,Mechanical,Third Year,Female,Yes,Very Interested,Right After Graduation,EdTech,3,3,3.0,"Web Development, Data Analysis, App Development","Product Management, Leadership",High,Lack of a Good Idea,"Prefer Job Security, Family Pressure / Expectations",Medium,Bootstrapping,IIM Incubation Cell,No,No,7.1
STU0155,Information Technology,Third Year,Female,Yes,Neutral,During College,GreenTech,4,3,3.5,"Programming / Coding, Cloud / DevOps","Product Management, Sales",Medium,Family Pressure / Expectations,"Fear of Failure, Unclear Market Opportunity",Medium,"Venture Capital, Angel Investors",YCombinator,No,No,6.2
STU0156,Information Technology,First Year,Female,Yes,Very Interested,After 2-3 Years of Job,EdTech,4,3,3.5,"App Development, Data Analysis",Financial Planning,Medium,Lack of Funding,Prefer Job Security,Low,"Bootstrapping, Venture Capital",IIT TBI,No,No,6.7
STU0157,MBA,Fourth Year,Male,No,Somewhat Interested,After 5+ Years,E-commerce,3,4,3.5,App Development,Marketing,High,Lack of Funding,"No Co-founder / Team, Lack of Business Knowledge",Low,"Government Grants, Crowdfunding","NASSCOM, None",No,Yes,6.7
STU0158,Computer Science,Third Year,Female,Yes,Very Interested,Right After Graduation,SaaS,4,3,3.5,"Cloud / DevOps, Programming / Coding","Leadership, Product Management",Medium,Fear of Failure,Lack of a Good Idea,Medium,Angel Investors,"IIT TBI, YCombinator",Yes,Yes,7.6
STU0159,Computer Science,Second Year,Female,No,Somewhat Interested,After 5+ Years,Gaming,4,4,4.0,App Development,Sales,Medium,Fear of Failure,"Lack of Business Knowledge, Lack of Funding",High,"College Incubator, Angel Investors",IIT TBI,Maybe,No,7.1
STU0160,Information Technology,Fourth Year,Male,Yes,Neutral,After 2-3 Years of Job,HealthTech,4,2,3.0,AI / Machine Learning,Product Management,Low,Prefer Job Security,"No Co-founder / Team, Lack of a Good Idea",Medium,Crowdfunding,"IIT TBI, Startup India",No,No,5.2
STU0161,Mechanical,First Year,Female,Yes,Somewhat Interested,During College,E-commerce,3,1,2.0,"Data Analysis, Cybersecurity, App Development","Communication, Sales, Networking",Medium,Fear of Failure,Lack of Business Knowledge,Medium,Bootstrapping,IIM Incubation Cell,Maybe,No,5.2
STU0162,Computer Science,First Year,Female,No,Somewhat Interested,During College,FinTech,3,2,2.5,"Web Development, App Development, Programming / Coding","Product Management, Communication",Medium,Fear of Failure,"Unclear Market Opportunity, Lack of a Good Idea",Medium,"Angel Investors, Government Grants","None, Startup India",Maybe,Yes,5.7
STU0163,Computer Science,Fourth Year,Male,No,Somewhat Interested,During College,EdTech,4,2,3.0,"Programming / Coding, Data Analysis, Web Development","Leadership, Networking",Low,Fear of Failure,"No Co-founder / Team, Lack of Funding",Medium,Venture Capital,Startup India,Yes,No,5.2
STU0164,Computer Science,Fourth Year,Male,Yes,Somewhat Interested,After 2-3 Years of Job,Gaming,4,3,3.5,"Data Analysis, AI / Machine Learning","Communication, Marketing, Sales",High,Lack of Funding,"Unclear Market Opportunity, Family Pressure / Expectations",Medium,Venture Capital,NASSCOM,Maybe,No,7.1
STU0165,BBA,Third Year,Female,Yes,Very Interested,After 5+ Years,Social Impact,3,4,3.5,Programming / Coding,"Leadership, Communication",Medium,Fear of Failure,"Lack of a Good Idea, Prefer Job Security",High,"Crowdfunding, Venture Capital","IIT TBI, None",Maybe,Yes,8.1
STU0166,Computer Science,Third Year,Prefer not to say,Yes,Neutral,Right After Graduation,Gaming,4,3,3.5,Web Development,"Leadership, Networking, Sales",Medium,Fear of Failure,Prefer Job Security,Medium,"Crowdfunding, Government Grants","IIM Incubation Cell, None",Maybe,Yes,6.7
STU0167,MBA,Fourth Year,Female,Yes,Somewhat Interested,After 2-3 Years of Job,E-commerce,2,2,2.0,"AI / Machine Learning, Programming / Coding, Cloud / DevOps","Leadership, Communication",High,Fear of Failure,Lack of a Good Idea,Medium,Bootstrapping,"Startup India, YCombinator",Maybe,Yes,6.2
STU0168,Computer Science,Fourth Year,Female,Yes,Very Interested,After 5+ Years,EdTech,2,2,2.0,"AI / Machine Learning, Web Development, Cybersecurity",Leadership,High,Fear of Failure,"Lack of a Good Idea, Family Pressure / Expectations",Medium,Venture Capital,YCombinator,Yes,No,6.2
STU0169,Electronics,Fourth Year,Prefer not to say,Yes,Neutral,After 5+ Years,EdTech,4,3,3.5,"Web Development, App Development, AI / Machine Learning","Product Management, Communication, Marketing",Medium,Lack of Business Knowledge,"Lack of Funding, Family Pressure / Expectations",High,"Venture Capital, College Incubator",IIM Incubation Cell,Maybe,Yes,7.1
STU0170,Computer Science,Third Year,Male,Yes,Not Interested,Never,SaaS,4,3,3.5,App Development,"Leadership, Communication, Marketing",Low,Lack of Business Knowledge,"Prefer Job Security, Fear of Failure",High,College Incubator,IIM Incubation Cell,No,No,5.7
STU0171,Civil,Third Year,Female,No,Neutral,Never,Social Impact,3,3,3.0,"Web Development, Data Analysis, App Development","Financial Planning, Sales, Communication",Low,Prefer Job Security,"Unclear Market Opportunity, Family Pressure / Expectations",High,"Crowdfunding, Venture Capital","IIT TBI, NASSCOM",Maybe,No,5.2
STU0172,Mechanical,Fourth Year,Female,Yes,Somewhat Interested,During College,FinTech,2,2,2.0,"Web Development, Programming / Coding","Sales, Product Management",High,Lack of Funding,"Unclear Market Opportunity, Lack of Business Knowledge",Medium,"College Incubator, Bootstrapping",NASSCOM,Yes,Yes,6.2
STU0173,MBA,Fourth Year,Male,No,Very Interested,After 2-3 Years of Job,EdTech,2,3,2.5,"App Development, Data Analysis, Programming / Coding","Leadership, Financial Planning, Communication",Medium,Lack of a Good Idea,"Family Pressure / Expectations, Unclear Market Opportunity",High,Crowdfunding,"IIT TBI, None",Yes,Yes,6.7
STU0174,Civil,Third Year,Male,Yes,Very Interested,After 2-3 Years of Job,AgriTech,3,3,3.0,Web Development,"Leadership, Financial Planning",Medium,Fear of Failure,Lack of a Good Idea,Low,"Crowdfunding, College Incubator","None, IIT TBI",Maybe,Yes,6.7
STU0175,Mechanical,Second Year,Female,No,Neutral,After 2-3 Years of Job,FinTech,2,3,2.5,"Programming / Coding, Cloud / DevOps, Data Analysis","Financial Planning, Communication, Sales",Low,Family Pressure / Expectations,"Prefer Job Security, Unclear Market Opportunity",Medium,"Angel Investors, Government Grants","YCombinator, NASSCOM",Yes,No,4.3
STU0176,Computer Science,Fourth Year,Male,Yes,Somewhat Interested,During College,FinTech,4,2,3.0,"Cybersecurity, Cloud / DevOps, AI / Machine Learning","Leadership, Financial Planning, Product Management",High,Lack of Funding,"Lack of Business Knowledge, Family Pressure / Expectations",Low,Venture Capital,"YCombinator, Startup India",Maybe,Yes,6.7
STU0177,Computer Science,Third Year,Male,No,Somewhat Interested,After 5+ Years,AI/ML,4,3,3.5,"Cloud / DevOps, Web Development, AI / Machine Learning","Sales, Communication",Low,Lack of a Good Idea,"Unclear Market Opportunity, Fear of Failure",Medium,"Government Grants, Venture Capital","Startup India, IIM Incubation Cell",Maybe,No,5.7
STU0178,Information Technology,Fourth Year,Female,Yes,Very Interested,After 5+ Years,Gaming,4,3,3.5,AI / Machine Learning,"Marketing, Sales, Leadership",Medium,No Co-founder / Team,Lack of a Good Idea,Low,Angel Investors,"None, NASSCOM",Yes,No,6.7
STU0179,Electronics,First Year,Male,No,Somewhat Interested,After 2-3 Years of Job,Gaming,3,3,3.0,"Data Analysis, Programming / Coding","Product Management, Communication, Financial Planning",Medium,Lack of Funding,"Lack of Business Knowledge, Unclear Market Opportunity",Medium,College Incubator,IIM Incubation Cell,Yes,No,5.7
STU0180,Information Technology,Fourth Year,Male,No,Neutral,After 2-3 Years of Job,AgriTech,4,3,3.5,Web Development,"Product Management, Leadership",High,Lack of Business Knowledge,Lack of Funding,Medium,Bootstrapping,None,Maybe,Yes,6.7
STU0181,Electronics,Third Year,Female,Yes,Not Interested,Never,E-commerce,3,3,3.0,"Web Development, Cybersecurity, Data Analysis","Sales, Networking",Medium,Prefer Job Security,Family Pressure / Expectations,Low,Crowdfunding,IIM Incubation Cell,No,Yes,5.2
